Notes,Paper_ID,Study_Area,Area_Code,Study_Code,Center_Long,Center_Lat,Coor_Given,Study_Start,Study_End,Study_Region,Study Country,Eco_Code_Olson,Realm_Olson,Biome_Olson,Bioregion_Olson,Suprarealm_OneEarth,Realm_OneEarth,Subrealm_OneEarth,Bioregion_OneEarth,Protected_Area,Avg_Temp_Ann,Avg_Temp_Min,Avg_Temp_Max,Avg_Precipitation,Avg_Rainfall,Avg_Snow,Snow_Period,Elev_Min,Elev_Max,Elev_Range,Area ,Range_Wolf_Dens,Avg_Wolf_Dens,n_Wolves,n_Packs,Range_Pack_Size,Avg_Pack_Size,Wolf_Notes,Livestock_Notes,Wild_Ung_Avail_n,Wild_Ung_Avail_Name,Beaver_Avail,Ecoregion_OneEarth,Paper_Pred_Tot_n,Pred_Larger_n,Pred_Larger_Name,Pred_Smaller_n,Pred_Smaller_Name,OE_Pred_Tot_n,OE_Pred_Larger_n,OE_Pred_Larger_Name,OE_Pred_Smaller_n,OE_Pred_Smaller_Name,HFI,Productivity
,Nowak 2005,Carpathian Mountains,CPM,NOK05CPM,19.10737,49.7234,"49°23’–49°53’ N, 18°45’–19°48’ E",1997,2001,,Poland,PA0504,PA,5,PA05,PA,WEE,EMF,PA14,Only 1% of forests are protected and located in a few nature reserves,,-3 - -6 (Jan),12 - 16 (July),,,,80-160 days,300,1557,300-1557,745,,,,,,,Wolves are protected in Poland but there is a 2 month hunting season in winter in slovakia,"""There are some agriculture and livestock farms, where small sheep and goat flocks are an important source of income""",,,,692,2,1,Brown bear (Ursus arctos),1,Lynx (Lynx lynx),,,,,,,
Mouflon and Fallow deer were introduced for game hunting but are present at low densitites (Mouflons were said to be present but not reported in diet or as a % of the species community),Nowak 2011,Bydgoszcz Forest,BYD,NOK11BYD,18.31349,52.98677,"N 52°50'–53°07', E 17°41'–18°45'",2002,2009,Central Poland,Poland,PA0412,PA,4,PA04,PA,WEE,GEM,PA12,,8.4,-2.7,18.2,NR,525,NR,50-80 days ,NR,116,116(highest)-?,640,,,,1 or 2,,<5-7,"Protected since 1998 in Poland. Permanent wolf presence since 2004. ""During the study period in each of our study sites only one, or eventually two resident wolf packs were present.""",Livestock in agricultural areas around the forest,5,"Red deer (Cervus elaphus), Roe deer (Capreolus capreolus), Wild boar (Sus scrofa), Fallow deer (Dama dama), Mouflon (Ovis gmelinii)",Yes,654,1,0,0,1,Red fox (Vulpes vulpes),,,,,,,
"Mouflon and Fallow deer were introduced for game hunting but are present at low densitites (Mouflons were said to be present but not reported in diet or as a % of the species community).  ""vegetation season length is 200-213 days"" is this the opposite of snow period? (ie. snow period would be 152-165 days?)",Nowak 2011,Wałcz Forest,WLF,NOK11WLF,16.64616,53.56762,"N 53°03'–53°38', E 16°04'–16°56'",2002,2009,North West Poland,Poland,PA0405,PA,4,PA04,PA,WEE,GEM,PA10,,8.1,NR,,NR,520,NR,see notes,100,205,100-205,1000,,,,1 or 2,,5-7,"Protected since 1998 in Poland. Recolonized in 2002. ""During the study period in each of our study sites only one, or eventually two resident wolf packs were present.""",Livestock in agricultural areas around the forest,5,"Red deer (Cervus elaphus), Roe deer (Capreolus capreolus), Wild boar (Sus scrofa), Fallow deer (Dama dama), Mouflon (Ovis gmelinii)",Yes,647,1,0,0,1,Red fox (Vulpes vulpes),,,,,,,
"Mouflon and Fallow deer were introduced for game hunting but are present at low densitites (Mouflons were said to be present but not reported in diet or as a % of the species community).   ""vegetation season length is 230-260 days""",Nowak 2011,Rzepin Forest,RZF,NOK11RZF,15.01472,52.23239,"N 52°02'-52°21', E 14°35'-15°28'",2002,2009,West Poland,Poland,PA0412,PA,4,PA04,PA,WEE,GEM,PA12,,8.3,see notes,see notes,NR,550,NR,see notes,NR,106,106 (highest),950,,,,1 or 2,,5-7,"Protected since 1998 in Poland. Resident wolves since 2004. ""During the study period in each of our study sites only one, or eventually two resident wolf packs were present.""",Livestock in agricultural areas around and within the forest,5,"Red deer (Cervus elaphus), Roe deer (Capreolus capreolus), Wild boar (Sus scrofa), Fallow deer (Dama dama), Mouflon (Ovis gmelinii)",Yes,654,1,0,0,1,Red fox (Vulpes vulpes),,,,,,,
"Mouflon and Fallow deer were introduced for game hunting but are present at low densitites (Mouflons were said to be present but not reported in diet or as a % of the species community). ""vegetation season length is 220 days""",Nowak 2011,Lower Silesian Forest,LSF,NOK11LSF,15.33486,51.42273,"N 51°14'-51°37', E 14°44'-15°54'",2002,2009,West Poland,Poland,PA0412,PA,4,PA04,PA,WEE,GEM,PA12,,8,see notes,see notes,NR,520-700,NR,see notes,107,235,107-235,1700,,,,1 or 2,,<5-7,"Protected since 1998 in Poland. Individual wolves since 2001, first resident pack established 2007. ""During the study period in each of our study sites only one, or eventually two resident wolf packs were present.""",Livestock in agricultural areas around and within the forest,5,"Red deer (Cervus elaphus), Roe deer (Capreolus capreolus), Wild boar (Sus scrofa), Fallow deer (Dama dama), Mouflon (Ovis gmelinii)",Yes,654,1,0,0,1,Red fox (Vulpes vulpes),,,,,,,
,Petridou 2019,Central Continental Greece,CCG,PEU19CCG,22.17873,39.05516,,2010,2012,,Greece,PA1201,PA,12,PA12,PA,WEE,MED,PA18,,,,,,,,,,,,612,,0.02450980392,15,2,NR,NR,15 indivuals belonging to 2 packs,,,,,785,NR,NR,NR,NR,NR,,,,,,,
0.24 black bear per km^2,Popp 2018,Great Lakes Region,GLR,POP18GLR,-80.82448,46.29197,"46° 20′30″N, 80° 50′ 30″W–46° 11′ 30″N, 80° 50′ 00″W",2013,2015,"Burwash region, Ontario ",Canada,NA0406,NA,4,NA04,NA,NOA,NAF,NA11,NR,NR,-12.5 (January mean),15 (July mean),NR,NR,average depth= 28cm (Dec-Feb),unclear,NR,300,max 300,450,0.2-0.3,,NR,NR,,NR,Wolves frequently hybridize with coyotes or other wolf-coyotes hybrids. 0.2-0.3km^2 wolves/hybrids,No mention,3,"Elk (Cervus elaphus), Moose (Alces alces), white-tailed deer (Odocoileus virginianus)",Yes,333,2,1,Black bear (Ursus americanus),1,coyotes (Canis latrans),,,,,,,
,Potvin 1988,Lake Stubbs,LKS,PON88LKS,-76.40710,46.2163,None given ,1974,1976,Laurentide Quebec,Canada,NA0406,NA,4,NA04,NA,NOA,NAF,NA11,,,-18,,,,274 (avg 62 days with depths >50 cm),,225,450,225-375 (occasionally exceeds 450),500,,,5-10,,,,1-2 wolves/100km2,,,,,333,,,,,,,,,,,,
,Potvin 1988,Papineau-Labelle reserve,PLR,PON88PLR,-75.21715,46.11183,None given ,1980,1984,Laurentide Quebec,Canada,NA0406,NA,4,NA04,NA,NOA,NAF,NA11,,,,,,,274 (avg 62 days with depths >50 cm),,225,450,225-375 (occasionally exceeds 450),2500,,,70,10,,,2.8/100km2,,,,,333,,,,,,,,,,,,
,Sand 2016,South-central Scandinavia,SCA,SAD16SCA,14.83519,60.28098,"58˚50'-61˚40'N, 11˚00'-18˚40' E",2001,2014,Scandinavia,Norway and Sweden,PA0608,PA,6,PA06,PA,SUE,SWB,PA8,,,-5,15,NR,NR,28.3 (2SE = +/- 9.1),NR,NR,NR,NR,164-1475 (mean= 766.27),need to calc for,need to calc for,92 in 2001 to 400 in 2014,17,2-9,4.35,"""average wolf population size increased from 92 (range 87–97, total count) to 400 (95% CI: 316–520) individuals"". Beavers, hare, grousse, and capercaillie present but make up low amounts of ingested wolf biomass. ""A risk-aversive strategy among Scandinavian wolves is further supported by the strong preference for young-of-the-year when preying on moose""",None,6,"Moose (Alces alces), Roe deer, Red deer (not widely available), Fallow deer (not widely available), wild boar (not widely available), semi-domestic reindeer (not widely available)",Yes,717,3,1,Brown bear (Ursus arctos),2,"Lynx (Lynx lynx), Wolverine (Gulo gulo)",,,,,,,
,Sears 2003,Frontenac Axis Region,FAR,SES03FAR,-77.00310,45.16057,"45°15'N, 77° W",1996,1998,Ontario ,Canada,NA0406,NA,4,NA04,NA,NOA,NAF,NA11,,,,,,,,,,,,1365,,,,,,,,,,,,333,,,,,,,,,,,,
,Shrotriya 2022,Ladakh and Spiti Trans-Himalayan Regions ,LSH,SHA22LSH,77.68098,33.62465,"31°30'-35°12' N, 76°-79° E",2014,2018,,India,PA1006,PA,10,PA10,PA,EAE,TIP,PA41,,,,,,,,,,,,60356,,,,,,,,,,,,754,,,,,,,,,,,,
"""The study period (1990-2000) was characterised by profound political changes and economical regress. This situation favoured uncontrolled exploitation of wild ungulates, which led to their fast, many-fold decline."" 78% is natural habitat, man transformed (field, pastures, meadow, human settlements, roads) covers 22-31%, dry meadows are 16% of whole region and 73% of the agricultural land. ""Though we have no precise data on ungulate hunting quotas and poaching intensity, the information obtained by interviewing the local hunters as well as our observations on the remnants of the poached moose and wild boar in the study area allowed us to roughly estimate that, since 1992, the killing rate of ungulates by humans could have increased 5 to 10-fold in comparison with earlier years and it remained heavy until 1995.""­",Sidorovich 2003,Lovat River,LVR,SIH03LVR,30.35036,55.72532,"55°45’N, 30°20'E",1990,2000,"Gorodok district, Vitebsk region",Belarus,PA0436,PA,4,PA04,PA,WEE,GEM,PA11,,,-6 (mean jan),18 (mean july),,,3max depth 30-90,"1.5-2 months of constant snow, snow period Late oct-mid april.",100,200,100-200,800,0.005-0.036,0.0175,4-29,NR,NR,NR,"""In the early 1990s, wolves were relieved from heavy control but few years later, when heavy damage to livestock caused complaints from farmers, hunting on wolves intensified"". Table 1 has wolf density by year","""The majority of these villages were small (5-26 houses and 9-67 inhabitants), but two were fairly large (49 and 84 houses, 147 and 242 inhabitants). Farmers mostly kept cows, pigs, hens, dogs and cats, whereas horses, sheep and geese were less common. Two collective farms ('kolkhoz') operated in the two large villages, and they had many cows (110 and 280), pigs (50 and 120), and horses (15 and 40).""",3,"Moose (Alces alces), roe deer (Capreolus capreolus), wild boar (Sus scrofa)",Yes,679,2,1,Brown bear (Ursus arctos),1,Lynx (Lynx lynx),,,,,,,
,Sidorovich 2017,Naliboki Forest,NBF,SIH17NBF,26.34279,53.85413,"53°55'N, 26°20'E",1999,2014,Central-western Belarus,Belarus,PA0412,PA,4,PA04,PA,WEE,GEM,PA12,,,,,,,,,,,,2750,,,,,,,,,,,,654,,,,,,,,,,,,
"Wild cat is very close to fox size. Include in pred? Habitat cover is 53% mixed forest, 28% conifer forest, 11% broad leaf forest, 7% pasture and natural grasslands, 1% agricultue. Snow cover lasts 62-170 days depending on altitude. Average snow depth from Jan-Feb is 51cm. ""However, since the fall of the communist regime in the late 1980s, the ecological integrity of these forests decreased continuously under the pressure of inefficiently controlled grazing and increasing tourism activities as well as recent changes in land ownership and forestry practices""",Sin 2019,South-Eastern Romanian Carpathians,SRC,SIN19SRC,26.47557,45.89229,"N 45.915, E 26.502",2013,2014,Carpathian Mountains,Romania,PA0504,PA,5,PA05,PA,WEE,EMF,PA14,"No - hunting of ungulates and carnivores to quotas, year-round logging, grazing from may-sept",NR,NR,NR,NR,NR,51,62-170 days ,491,1785,491-1785,600,NK,NK,NK,NK,NK,NK,"No reliable estimates of wolf pack numbers. Romanian wolf pop is one of the largest in Europe. Wolves never disappeared from Romania, so traditional sheperd practices and livestock protection have remained the same.","Yes, abundant",4,"Red deer, roe deer, wild boar, chamois",UK,692,4,1,Brown bear (Ursus arctos),3,"Fox (Vulpes vulpes), european lynx (Lynx lynx), wildcat (Felis silvestris)",,,,,,,
,Śmietana 2005,Bieszczady Mountains,BZM,SMA05BZM,22.62551,49.16447,49°00’–18’N 22°25’–54’E,1991,2002,Carpathians,Poland,PA0504,PA,5,PA05,PA,WEE,EMF,PA14,,,,,,,,,,,,600,,,,,,,,,,,,692,,,,,,,,,,,,
"""Other ungulates available to wolves, such as elk (Cervus elaphus), deer (Odocoileus spp.), mountain sheep (Ovis spp.), and mountain goats (Oreamnos americanus) are uncommon.""",Steenweg 2015,Parsnip River study area (PRSA),PRR,STG15PRR,-121.75098,55.00142,55° N 122 °W,2008,2009,British Columbia,Canada,NA0509,NA,5,NA05,NA,NOA,AMW,NA13,"No, 25% has been harvested for timber",,,,,,,,600,1650,600-1650,NR,,,35,7,,,Approximately 35 wolves across 7 packs,,6,"Moose (Alces americanus), mountain caribou (Rangifer tarandus caribou), elk (Cervus elaphus), deer (Odocoileus spp.), mountain sheep (Ovis spp.), mountain goats (Oreamnos americanus)",Yes,350,6,3,"Grizzly bear (Ursus arctos), Black bear (Ursus americanus), Cougars (Puma concolor)",3,"Lynx (Lynx lynx), wolverine (Gulo gulo), coyotes (Canis latrans)",,,,,,,
"From Hoy 2021: ""Wolf abundance was estimated each MarcheApril from counts of adults and 11-month-old pups. Wolf abundance fluctuated between 40 and 106 wolves, with an average pack size of 10-11 wolves, during the study period (Smith & Bangs, 2009).""",Tallian 2017,Yellowstone National Park Winter Range,YNP-P,TAN17YNP-P,-110.40080,44.92561,,1995,2015,Wyoming,USA,NA0528,NA,5,NA05,NA,NOA,AMW,NA13,,,,,,,,,1500,2600,1500-2600,995,0.0402-0.1065,NR,40-106,see notes,NR,11,"3 to 5 wolf packs followed during a given biannual follow. Over the 20 years, 30 packs inhabited study area, 18 were intensively monitored. Number of individuals per pack not given. From Hoy 2021: ""Wolf abundance was estimated each March-April from counts of adults and 11-month-old pups. Wolf abundance fluctuated between 40 and 106 wolves, with an average pack size of 10-11 wolves, during the study period (Smith & Bangs, 2009).""",,6,"elk and bison, deer (Odocoileus spp.), bighorn sheep (Ovis canadensis), moose (Alces alces) and pronghorn (Antilocapra americana) ",,367,,,,,,,,,,,,
"ongoing decline of wildlife populations has been recorded during the last decades while livestock numbers grew from 25million to >45million in Mongolia. Had consistent reporting of livestock depredation rates up until the Soviet Union collapsed. ""Biodiversity hotspot""",Tiralla 2021,Khonin Nuga,KNN,TIA21KNN,107.28347,49.08356,"49°05′ N, 107°17′ E",2008,2012,Northern Mongolia,Mongolia,PA0609,PA,6,PA06,PA,SUE,SEB,PA7,Undisturbed buffer zone of a protected area,NR,NR,NR,NR,NR,NR,NR,900,1600,900-1600,450,NK,NK,NK,1 at least ,NK,few,At least one wolf pack according to park rangers. The wolf density and home range size in Khonin Nuga is unknown,"Not present within study area, but highly abundant throughout Mongolia",5,"Wild boar (Sus scrofa), Siberian roe deer (Capreolus pygargus), Red deer (Cervus elaphus), Siberian musk deer (Moschus moschiferus), Moose (Alces alces)",No,718,NR,NR,NR,NR,NR,,,,,,,
,Tremblay 2001,Lac Jacques-Cartier Highlands,LJC,TRY01LJC,-71.37835,47.70686,None given ,1996,1997,Quebec,Canada,NA0406,NA,4,NA04,NA,NOA,NAF,NA11,Increased logging in area. Study area includes two conservation parks (980km^2 total),NR,-15,15,NR,NR,400-700,summer study,400,1100,400-1100,2500,NR,0.0074,20-28 (studied),2 (studied),7-15,12,"""In North America, the gray wolf (Canis lupus) is a specialist predator preying almost exclusively on ungulates and beaver"" (very first line of intro). Wolf density kept low since 1990. But special protection accorded to 2 packs which raised denisty to 0.0074 wolves/km^2 over the course of the study. Those two packs (Malbaie(MB) and Grands-Jardins(GJ)) were studied. In 1996 MB pack = 13 wolves (2 adults, 4 juv, 7 pups), in 1997=15 wolves (5 adults, 3 juv, 7 pups). In 1996 GJ pack= 7 wolves (2 adults, 1 juv, 5 pups) , in 1997= 13 wolves (2 adults, 4 juvs, 7 pups)",No mention,2,"Moose (Alces alces), Woodland caribou (Rangifer tarandus)",Yes,333,3,1,Black bear (Ursus americanus),2,"Red fox (Vulpes vulpes), Lynx (Lynx lynx)",,,,,,,
"""main wildlife prey species available to wolves are red deer (Cervus elaphus) and marmots (Marmota sibirica)."" ""Przewalski horses became extinct in the wild in Mongolia in the 1960s, but 84 horses have been reintroduced since a reintroduction program started in 1992."" 4% was forrested, the rest is steppe. All research was within park boundaries except interviews with herdsman (in the summer or winter camps and in the buffer zone). Park is not fenced but most wildlife occur only in the park",van Duyne 2009,Hustai National Park,HNP,VAE09HNP,105.89353,47.68209,"47°46'N, 105°52'E",2003,2005,100km south of Ulaanbaatar,Mongolia,PA0813,PA,8,PA08,PA,EAE,MOG,PA44,"yes ~ hunting, logging and livestock grazing prohibited",0.2,NR,NR,270,NR,NR,NR,NR,NR,NR,506,NR,NR,20-50,NR,NR,NR,"HNP staff estimated 50 wolves, authors estimated 20-50 wolves based on wolf energy requirement calculations, interview data, and scat analysis. flexible and opportunistic. wolves were known to have larger home ranges and hunt outside the park. ""Our results concur with those of Jedrzejewski et al. (2005) who revealed that places where wolves were spotted were closer to forests and on higher altitudes than places without wolves. In forests wolves find suitable den sites and food resources.""",present only in buffer zone,5,"Red deer (Cervus elaphus), roe deer (Capreolus capreolus), Mongolian gazelle (Procapra gutturosa), wild boar (Sus scrofa), Przewalski horse (Equus ferus przewalskii)",No,734,2,0,,2,"Lynx (Lynx lynx), red fox (Vulpes vulpes)",,,,,,,
Low wild ungulate density and high livestock production. Sheperds use perscribed burning to inhibit forest succession and keep the area open for their goats. Wild boar presence is sporadic and only at low altitudes,Vos 2000,Arada Mountain Range,AMR,VOS00AMR,-8.08362,40.9161,"40˚55'N, 08˚05'W",1996,1996,North-east Portugal,Portugal,PA0406,PA,4,PA04,PA,WEE,GEM,PA10,"No, hunting is regular ",,,,2000,,0,,250,1070,250-1070,130,NR,NR,NR,1 (studied),NR,NR,"*1 pack studied. unclear if they are the only pack in the area. Wolves present in the area ""since historical times""",Highly abundant,1,Wild boar,,648,NR,NR,NR,NR,NR,,,,,,,
"Low wild ungulate density and high livestock production. Wild boar present in valley bottoms, roe deer at low numbers",Vos 2000,Peneda-Gerês National Park,PNG,VOS00PNG,-8.29951,41.94697,"41˚57'N, 08˚15'W",1996,1996,Northern Portugal,Portugal,PA0406,PA,4,PA04,PA,WEE,GEM,PA10,"Yes, but poaching is regular",,,,2000,,0,,140,1483,140-1483,240,NR,NR,NR,1 (studied),NR,NR,"*1 pack studied. unclear if they are the only pack in the area. Wolves present in the area ""since historical times""",Highly abundant,2,"Wild boar, Roe deer",,648,NR,NR,NR,NR,NR,,,,,,,
possible SP and SA overlap,Wagner 2012,Lusatian heath ,LUH,WAR12LUH,14.49222,51.4815,None given,2001,2009,North Eastern Saxony and southern Brandenburg,Germany,PA0412,PA,4,PA04,PA,WEE,GEM,PA12,,,,,,,,,,,,2500,,,,,,,,,,,,654,,,,,,,,,,,,
also reports Levins index (B),Werhahn 2019,Humla,HUM,WEN19HUM,81.65959,30.34222,None given ,2015,2015,Sanjiangyuan National Nature Reserve,Nepal,PA1021,PA,10,PA10,PA,EAE,TIP,PA41,Nature reserve,NR,NR,NR,NR,NR,summer study ,summer study,4560,5120,4560-5120,384,NR,NR,NR,NR,NR,5,Mean pack size observed was 5 wolves,Highly abundant,4,"Kiang, Tibetan gazelle, Tibetan argali, Naur",No,769,5,2,"Snow leopard (Panthera unica), Brown bear (Ursus arctos)",3,"Red fox (Vulpes vulpes), Tibetan fox (Vulpes ferrilata), Eurasian lynx (Lynx lynx)",,,,,,,
also reports Levins index (B),Werhahn 2019,Dolpa,DOL,WEN12DOL,83.23936,29.36201,None given ,2016,2016,Sanjiangyuan National Nature Reserve,Nepal,PA1021,PA,10,PA10,PA,EAE,TIP,PA41,Nature reserve,NR,NR,NR,NR,NR,summer study ,summer study,3850,5540,3850-5540,1088,NR,NR,NR,NR,NR,5,Mean pack size observed was 5 wolves,Highly abundant,3,"Tibetan argali, Naur, Tibetan gazelle",No,769,5,2,"Snow leopard (Panthera unica), Brown bear (Ursus arctos)",3,"Red fox (Vulpes vulpes), Tibetan fox (Vulpes ferrilata), Eurasian lynx (Lynx lynx)",,,,,,,
also reports Levins index (B),Werhahn 2019,Kanchenjunga Conservation Area (KCA),KCA,WEN12KCA,87.96841,27.77753,None given ,2016,2016,Inner Valleys of the eastern Himalayas,Nepal,PA1003,PA,10,PA10,PA,EAE,TIP,PA41,Conservation area,NR,NR,NR,NR,NR,summer study ,summer study,3980,5150,3980-5150,368,NR,NR,NR,NR,NR,5,Mean pack size observed was 5 wolves,Highly abundant,1,Naur,No,751,5,2,"Snow leopard (Panthera unica), Brown bear (Ursus arctos)",3,"Red fox (Vulpes vulpes), Tibetan fox (Vulpes ferrilata), Eurasian lynx (Lynx lynx)",,,,,,,
also reports Levins index (B),Werhahn 2019,Zhaqing,ZHA,WEN12ZHA,96.33672,33.46149,None given ,2017,2017,Tibetan Plateau,China,PA1017,PA,10,PA10,PA,EAE,TIP,PA40,,NR,NR,NR,NR,NR,summer study ,summer study,4380,4800,4380-4800,452,NR,NR,NR,NR,NR,5,Mean pack size observed was 5 wolves,Highly abundant,3,"Naur, Tibetan gazelle, White-lipped deer",No,765,5,2,"Snow leopard (Panthera unica), Brown bear (Ursus arctos)",3,"Red fox (Vulpes vulpes), Tibetan fox (Vulpes ferrilata), Eurasian lynx (Lynx lynx)",,,,,,,
also reports Levins index (B),Werhahn 2019,Namsai,NAM,WEN12NAM,96.90831,33.17576,None given ,2017,2017,Tibetan Plateau,China,PA1017,PA,10,PA10,PA,EAE,TIP,PA40,,NR,NR,NR,NR,NR,summer study ,summer study,4360,4770,4360-4770,175,NR,NR,NR,NR,NR,5,Mean pack size observed was 5 wolves,Highly abundant,3,"Naur, White-lipped deer, Tibetan gazelle",No,765,5,2,"Snow leopard (Panthera unica), Brown bear (Ursus arctos)",3,"Red fox (Vulpes vulpes), Tibetan fox (Vulpes ferrilata), Eurasian lynx (Lynx lynx)",,,,,,,
Avg pack size and range pack size based on Parks canada report (see Paper Basics; Data Usuage),Zabihi-Seissan 2022,Riding Mountain National Park,RDM,ZAN22RDM,-100.19372,50.83333,"50°51′50″N, 100°02′10″W",2016,2017,Manitoba,Canada,NA0608,NA,6,NA06,NA,SUA,CBF,NA8,National park,NR,NR,NR,NR,NR,NR,NR,NR,NR,NR,3000,NR,0.024,70(2017)-72(2016),8,2-11,5.25,"17 GPS wolves across 6 packs. Pop estimated as 72 wolves in 2016 and 70 wolves in 2017. Density = 0.024 wolves/km^2. ""Wolves in the western portion of Riding Mountain were ftted with GPS collars in three packs and one lone wolf in Jan-Feb 2016 (n=13), and in six-packs Jan-Feb 2017 (n=14) representing 60% of packs in the park and 100% coverage of packs in the western ‘core’ area."" 8 wolf packs studied (7 with unique density measures, and 2 seperate years for one pack). According to Parks canada survey 13 packs total (https://open.canada.ca/data/en/dataset/71a0e894-178f-45df-978b-ae6b6ed1eabd/resource/19956058-a078-4de5-85d7-70c7ccb69772) ",No mention,3,"Elk, moose, white-tailed deer",Yes,376,NR,NR,NR,NR,NR,,,,,,,